{
  "schema": "date-v3-benchmark-v1",
  "benchmark_id": "MESH-INTERCLUSTER-UR",
  "title": "1024-node inter-cluster single-destination sanity traffic (backup only)",
  "traffic": "mesh_intercluster_ur",
  "packet_flits": 5,
  "multicast": false,
  "src_neq_dst": true,
  "dst_not_same_l2_subtree": false,
  "fanout_F": null,
  "spread_S": null,
  "multicast_fraction": 0.0,
  "destination_set_samples": null,
  "warmup_original_events": 1000,
  "measurement_original_events": 10000,
  "seed_set_id": "v3_main_seeds",
  "paired_trace": true,
  "load_sweep": {
    "enabled": true,
    "coarse_then_fine": true,
    "load_unit": "MFlit_per_port_s",
    "case_tick_ns": 1.0,
    "coarse_loads": [100, 200, 300, 400, 500],
    "saturation_rule": "highest offered load with zero errors on all 3 seeds, drainable after measurement, no sustained backlog growth; report delivered throughput and mean latency; do not use 2x zero-load"
  },
  "metrics": [
    "saturation_throughput",
    "topmesh_util"
  ],
  "tmax_definition": "last destination tail minus source header injection",
  "applies_to_designs": [
    "PROP1024_MESH1",
    "PROP1024_MESH2",
    "PROP1024_MESH4"
  ],
  "paper_figures": [
    "backup"
  ],
  "notes": "Default backup only.",
  "display_name": "1024-node inter-cluster single-destination sanity traffic (backup only)"
}
