{
  "schema": "date-v3-benchmark-v1",
  "benchmark_id": "FPGA-MULTICAST",
  "title": "FPGA F=4, F=16, Q64 broadcast, all-destination completion",
  "traffic": "fpga_multicast",
  "packet_flits": 5,
  "multicast": true,
  "src_neq_dst": true,
  "dst_not_same_l2_subtree": false,
  "fanout_F": 16,
  "spread_S": null,
  "multicast_fraction": 1.0,
  "destination_set_samples": null,
  "warmup_original_events": 0,
  "measurement_original_events": 64,
  "seed_set_id": "v3_main_seeds",
  "paired_trace": true,
  "load_sweep": {
    "enabled": false,
    "coarse_then_fine": false,
    "saturation_rule": "n/a"
  },
  "metrics": [
    "all_destination_completion",
    "tmax"
  ],
  "tmax_definition": "last destination tail minus source header injection",
  "applies_to_designs": [
    "FPGA_ASYNC_PROP64",
    "FPGA_SYNC_PROP64"
  ],
  "paper_figures": [
    "fpga_validation"
  ],
  "notes": "",
  "display_name": "Field-programmable gate-array multicast completion traffic"
}
