{
  "schema": "date-v3-benchmark-v1",
  "benchmark_id": "XMC-F16",
  "title": "1024-node fixed sixteen-destination cross-group multicast traffic, spread 1/4/16",
  "traffic": "xmc_f16",
  "packet_flits": 5,
  "multicast": true,
  "src_neq_dst": true,
  "dst_not_same_l2_subtree": false,
  "fanout_F": 16,
  "spread_S": [
    1,
    4,
    16
  ],
  "multicast_fraction": 1.0,
  "destination_set_samples": 32,
  "warmup_original_events": 0,
  "measurement_original_events": 32,
  "seed_set_id": "v3_main_seeds",
  "paired_trace": true,
  "load_sweep": {
    "enabled": false,
    "coarse_then_fine": false,
    "saturation_rule": "n/a"
  },
  "metrics": [
    "top_mesh_injections",
    "top_mesh_link_traversals",
    "tmax",
    "energy_per_original_event"
  ],
  "tmax_definition": "last destination tail minus source header injection",
  "applies_to_designs": [
    "PROP1024",
    "HREP1024"
  ],
  "paper_figures": [
    "Fig. C"
  ],
  "notes": ">=32 paired destination-set samples. Bootstrap 95% CI allowed.",
  "display_name": "1024-node fixed sixteen-destination cross-group multicast traffic",
  "display_description": "Fixed fanout-16 multicast whose destinations cross cluster groups on the 1024-node hierarchical network."
}
